school_code,school_slug,school_name,short_summary,long_summary,sources,source_hash,updated_at
3619,,kent-ridge-secondary-school,"Kent Ridge Secondary School fosters a culture grounded in its vision of nurturing students with the Heart of a Saint, Passion of an Inventor, and Will of an Olympian. The school emphasizes holistic education with strong values of Fitness, Integrity, Respect, and Excellence. Character development and academic learning are integrated through explicit teaching and experiential platforms like the KR Hands-on community service and EVOKE@KR outdoor education. Leadership is cultivated using Kouzes and Posner’s Five Practices of Exemplary Leadership. The school promotes 21st century competencies including communication, collaboration, creativity, and self-directed learning, supported by programs in robotics and the arts. Teachers play a pivotal role in guiding students to become gracious citizens, passionate learners, and resilient leaders, embodying the school motto","Kent Ridge Secondary School, established in 2000 and located at West Coast Road, is committed to holistic education that balances academic excellence with character development. The school’s vision is to nurture students who embody the Heart of a Saint, Passion of an Inventor, and Will of an Olympian, reflecting compassion, creativity, and perseverance. Its core values—Fitness, Integrity, Respect, and Excellence—are instilled through both explicit instruction and experiential learning opportunities. The school’s Values-in-Action program, KR Hands-on, engages students in community service annually, fostering empathy and social responsibility. Leadership development is structured around Kouzes and Posner’s Five Practices of Exemplary Leadership, equipping students with skills to lead themselves and others. Kent Ridge also prioritizes 21st century competencies such as communication, collaboration, creative thinking, and self-directed learning, supported by initiatives like the Applied Learning Programme in Computational Thinking through Robotics and the EVOKE@KR outdoor education program. The arts are celebrated through the Vivace! performing arts showcase, which also integrates community partnerships. Teachers are central to the school culture, dedicated to nurturing students to be gracious citizens, passionate learners, and resilient leaders. The school motto “Beyond Frontiers” encapsulates its ethos of striving for continuous improvement and excellence in all endeavors.","[{""url"":""https://www.kentridgesec.moe.edu.sg/about-krss/history/""},{""url"":""https://www.kentridgesec.moe.edu.sg/about-krss/principals-message/""},{""url"":""https://www.kentridgesec.moe.edu.sg/about-krss/school-crest-and-song/""},{""url"":""https://www.kentridgesec.moe.edu.sg/about-krss/schools-directions/school-strategy-focus/""},{""url"":""https://www.kentridgesec.moe.edu.sg/about-krss/schools-directions/student-outcomes/""},{""url"":""https://www.kentridgesec.moe.edu.sg/about-krss/schools-directions/tl-framework/""},{""url"":""https://www.kentridgesec.moe.edu.sg/about-krss/vision-mission-values/""}]",2590c6905c3fac308f56f52e6e757a6358e78c40,2025-09-14 02:30:21+00
3620,,westwood-secondary-school,"Westwood Secondary School fosters a culture rooted in character, resilience, and holistic development. Emphasizing values-based education, the school nurtures students to be confident, socially responsible, and innovative through academic learning, co-curricular activities, and strong student well-being support. Programs like Character & Citizenship Education, Student Leadership Development, and the Gear-Up mentorship initiative provide platforms for leadership, service, and personal growth. The school prioritizes a safe, caring environment where every student is valued and supported emotionally, socially, and physically. Westwood’s approach encourages students to be courageous, collaborative, and ready to contribute positively to society, reflecting its vision of producing individuals who are “Rooted in Character to Soar for the Nation.”","Westwood Secondary School’s culture centers on holistic student development anchored by strong values and character education. Guided by the philosophy “Rooted in Character to Soar for the Nation,” the school views every student as a unique individual with potential beyond academics, including leadership, collaboration, and service. The school’s three pillars—Academic Curriculum, Co-Curriculum, and Student Well-Being—work together to build foundational knowledge, provide platforms for leadership and community service, and ensure a safe, nurturing environment. Co-curricular offerings include Character & Citizenship Education, Student Leadership Development, Values-in-Action, and enrichment experiences that cultivate empathy, camaraderie, and moral courage. A key initiative, the Gear-Up Programme, offers structured mentorship and support to students needing additional guidance, focusing on physical, intellectual, emotional, and spiritual growth. Westwood emphasizes a culture of care through restorative practices and strong staff-student relationships, ensuring every student feels known, valued, and supported. Financial assistance schemes and accessible counseling services further demonstrate the school’s commitment to inclusivity and student welfare. The school’s vision encourages Westwoodians to be confident risk-takers with an international outlook, ready to innovate and serve their communities. This collective effort among school, parents, and community aims to nurture socially responsible individuals equipped with 21st-century competencies and a deep sense of purpose.","[{""url"":""https://www.westwoodsec.moe.edu.sg/about-us/about-westwood/""},{""url"":""https://www.westwoodsec.moe.edu.sg/about-us/principals-message/""},{""url"":""https://www.westwoodsec.moe.edu.sg/co-curriculum/student-development/""},{""url"":""https://www.westwoodsec.moe.edu.sg/co-curriculum/student-development/student-well-being/""}]",6b71b4871a8d5b109a2c6dd474c7ffbfbfdd0b59,2025-09-14 02:30:27+00
3621,,canberra-secondary-school,"Canberra Secondary School cultivates Future-Ready Canberrans grounded in the core values of Gratitude, Respect, and Compassion. The school emphasizes a rigorous curriculum that develops digital competencies and 21st Century skills such as Adaptive Thinking and Civic Literacy. Holistic character and leadership development are fostered through a broad co-curricular program. Staff professional growth is supported via initiatives like the Teacher Growth Model. Canberra integrates technology through its Masterplan 2030, promoting responsible digital citizenship and real-world learning. The school culture encourages students to be creators, connectors, and contributors, preparing them to thrive in a dynamic global environment with a strong focus on service, collaboration, and innovation.","Canberra Secondary School’s culture is centered on nurturing Future-Ready Canberrans who embody the core values of Gratitude, Respect, and Compassion. The school’s vision and mission focus on growing minds and glowing hearts, preparing students not only academically but also as socially responsible individuals. The curriculum is designed to be rigorous and future-oriented, emphasizing mastery of nine essential digital competencies and refreshed 21st Century Competencies such as Adaptive Thinking, Communication, Civic Literacy, and Inventive Thinking. This equips students to navigate a rapidly evolving technological landscape. The co-curricular program enhances character and leadership development, fostering respectful connectors and compassionate contributors who positively impact their communities. Staff capacity is strengthened through professional development initiatives like the Teacher Growth Model, ensuring educators can effectively nurture future-ready learners. Canberra’s Masterplan 2030 integrates advanced digital tools into teaching and learning, with a strong emphasis on student cyber wellness to promote responsible digital engagement. The school embraces real-world learning beyond the classroom, encouraging students to be creators of solutions, connectors who build bridges, and contributors who make meaningful societal impacts. This culture of collaboration, service, and innovation supports students in thriving amid global challenges and opportunities, reflecting a shared commitment to excellence and transformation.","[{""url"":""https://www.canberrasec.moe.edu.sg/canberra/principals-message/""},{""url"":""https://www.canberrasec.moe.edu.sg/canberra/school-crest-school-song/""},{""url"":""https://www.canberrasec.moe.edu.sg/canberra/vision-mission-values-motto/""}]",8305346a4ded7bc6878b88598280d53480a8553b,2025-09-14 02:30:32+00
3622,,compassvale-secondary-school,"Compassvale Secondary School (CVSS) fosters a vibrant, inclusive community focused on holistic development. Guided by its vision of nurturing world-ready youth, CVSS emphasizes values of Confidence, Commitment, Creativity, and Compassion. The school integrates learning through Six Integrated Competencies and Development Clusters, enhanced by specialized programs such as ACES (Aeronautics, Coding, Engineering), the Green Compass sustainability initiative, Digital Media Literacies, and Perspectives Overseas Learning. CVSS supports students to be adaptable, innovative leaders with strong character, preparing them for diverse post-secondary pathways. The school also prioritizes contemporary pedagogy, infrastructural upgrades, and staff excellence, aiming to cultivate lifelong learners and community-minded citizens who learn, grow, and lead together.","Compassvale Secondary School (CVSS) celebrates its 25th anniversary in 2025, marking a milestone in its commitment to nurturing every student’s potential, whom it calls “North Stars.” The school’s vision is to develop world-ready youth who are adaptable, innovative, discerning leaders grounded in good character, capable of positively impacting society. CVSS’s mission is to build a vibrant and uplifting community where students and staff learn, grow, and lead together. The school’s core values—Confidence, Commitment, Creativity, and Compassion—are embedded in its culture and programs. Learning is structured around Six Integrated Competencies and Development Clusters, ensuring interdisciplinary relevance and skill development. Signature programs include the Enhanced ALP ACES focusing on Aeronautics, Coding, and Engineering; the sustainability-driven Green Compass Programme; Digital Media Literacies; and Perspectives Overseas Learning Experiences, which recently expanded to include another ASEAN country. These initiatives prepare students to be agile and future-ready. CVSS also emphasizes inclusivity, lifelong learning, and character development, fostering students who serve and lead with distinction. The school has invested in infrastructure upgrades, including a new classroom block and a modernized library, to support contemporary pedagogical approaches. Staff achievements, such as national awards, reflect the school’s dedication to educational excellence. Overall, CVSS aims to cultivate confident, committed, creative, and compassionate individuals who realize their star within and contribute meaningfully to their communities.","[{""url"":""https://www.compassvalesec.moe.edu.sg/about-us/principals-message-2025/""},{""url"":""https://www.compassvalesec.moe.edu.sg/about-us/vision-mission-values/""}]",cf03a1e75d932b081f05b4a3e720152a924ad350,2025-09-14 02:30:37+00
3623,,evergreen-secondary-school,"Evergreen Secondary School fosters a culture centered on lifelong learning and strong character development, encapsulated in its vision “Evergreen in Learning, Exceptional in Character.” The school emphasizes values such as respect, integrity, commitment, and enterprise, nurturing students to be responsible, adaptable, and compassionate citizens. With a focus on National Education and community engagement, Evergreen encourages students to lead with purpose and contribute meaningfully to society while maintaining discipline and a passion for continuous growth.","Evergreen Secondary School’s culture is deeply rooted in its vision of being “Evergreen in Learning, Exceptional in Character.” This reflects a dual commitment to nurturing a lifelong passion for learning and cultivating strong moral values. The school draws inspiration from the evergreen tree, symbolizing resilience and continual renewal, which aligns with its goal to equip students with curiosity, adaptability, and resilience for future challenges. Character education is central, with a focus on respect for self and others, integrity in actions, commitment to responsibilities across personal and communal spheres, and enterprise demonstrated through perseverance and resourcefulness. Evergreen integrates National Education as a foundational element, fostering a sense of belonging and responsibility towards the nation and multicultural harmony. The school encourages students to embody these values by leading with compassion, supporting peers, and striving for excellence in all pursuits. This holistic approach aims to develop well-rounded individuals who contribute positively to their communities and uphold the school’s ethos of being “Exceptionally Evergreen.”","[{""url"":""https://www.evergreensec.moe.edu.sg/about-us/principals-message/""},{""url"":""https://www.evergreensec.moe.edu.sg/about-us/vision-mission-values/""}]",ec80f76355cc3327a1845ca55980a26c57ee7381,2025-09-14 02:30:41+00
7001,,anglochinese-school-independent-secondary,"ACS (Independent) is a Methodist school founded in 1886 with a focus on nurturing students to serve “for God and humanity.” It offers a holistic education grounded in spiritual values and the SHIELD values (Steadfastness, Humility, Integrity, Empathy, Loyalty, Diligence). The school provides two academic tracks: the Express programme leading to GCE O-Levels and the Integrated Programme leading to the IB Diploma. ACS (Independent) emphasizes character development, leadership, and service through Values-In-Action projects and corporate social responsibility initiatives, including support for special needs, cancer awareness, and environmental sustainability. The school fosters a strong community spirit, guided by the ACS Spirit of academic and co-curricular excellence, integrity, and service, aiming to develop students as scholars, leaders, and global citizens.","Anglo-Chinese School (Independent), established in 1886 by Methodist Bishop William Fitzjames Oldham, is a school with a strong foundation in Christian values and a mission to nurture students to be catalysts for change “for God and humanity.” The school offers two main academic pathways: a four-year Express programme culminating in the GCE O-Level examinations, and a six-year Integrated Programme (IP) leading to the International Baccalaureate (IB) Diploma, for which ACS (Independent) was the first national school in Singapore to gain accreditation. The school’s philosophy centers on holistic development, emphasizing not only academic excellence but also character formation through the SHIELD values—Steadfastness, Humility, Integrity, Empathy, Loyalty, and Diligence. Teachers play a pivotal role as mentors and stewards of students’ moral and intellectual growth, fostering a supportive and disciplined environment. ACS (Independent) actively promotes corporate social responsibility, engaging students and staff in community service projects focused on special needs inclusion, cancer awareness, and aid for the less fortunate, alongside environmental sustainability initiatives such as ‘Go Green.’ The school’s Values-In-Action (VIA) framework encourages student-led projects to cultivate empathy and social responsibility. The ACS Spirit, a tradition dating back to the 1920s, embodies academic and co-curricular excellence, integrity, and a heart of service, uniting the school community. Overall, ACS (Independent) aims to develop well-rounded individuals equipped to serve and lead in family, nation, and the global community.","[{""url"":""https://www.acsindep.moe.edu.sg/about-acs-independent/heritage/""},{""url"":""https://www.acsindep.moe.edu.sg/about-acs-independent/heritage/our-crest-2/""},{""url"":""https://www.acsindep.moe.edu.sg/about-acs-independent/school-profile/""},{""url"":""https://www.acsindep.moe.edu.sg/about-acs-independent/school-profile/corporate-social-responsibility/""},{""url"":""https://www.acsindep.moe.edu.sg/about-acs-independent/school-profile/school-philosophy/""},{""url"":""https://www.acsindep.moe.edu.sg/about-acs-independent/school-profile/school-values/""}]",87ae6077de0053dd68ae94d7e2d50a4d35f77fef,2025-09-14 02:30:48+00
7002,,assumption-english-school,"Assumption English School (AES) is a Catholic mission school that nurtures students as AssumptionKnights embodying Fortitude, Mastery, and Charity. Guided by the Montfortian Spirit and CHRIST values—Compassion, Humility, Respect, Integrity, Sense of Responsibility, and Trust—AES emphasizes character development alongside academic learning. Students progress through symbolic milestones from Secondary 1 to 5, reflecting growth in faith, leadership, and resilience. The school fosters a supportive environment promoting joy in learning, leadership with purpose, and service to community. Programs like the Dinan Leadership Programme and the Asian Youth Leaders for Human Fraternity encourage service learning and cultural exchange. AES’s ethos is rooted in perseverance, inclusivity, and holistic education, preparing students to be men and women of character and learning in service of God","Assumption English School (AES), established in 1953 and rooted in the Montfortian tradition, is a co-educational Catholic mission school committed to educating the whole person. The school identity centers on the AssumptionKnight mascot, symbolizing the core student outcomes of Fortitude, Mastery, and Charity. Students embark on a developmental journey marked by symbolic milestones: receiving the cape at Secondary 1 to signify embarking on their AES journey, the Shield of Faith at Secondary 2 to represent deepening values, and the sword at Secondary 3 to mark leadership growth. By Secondary 4 and 5, students embody strong character and learning, ready to contribute meaningfully to society. AES’s mission is to nurture men and women of character and learning who serve God and community, guided by CHRIST values—Compassion, Humility, Respect, Integrity, Sense of Responsibility, and Trust. These values shape students’ moral compass and interpersonal conduct, fostering empathy, honesty, accountability, and inclusivity. The school’s Montfortian Education Charter further emphasizes spiritual vision, inclusive education, participatory learning, innovation, and respect for community and environment. The school culture promotes a positive learning disposition where students are encouraged to be resilient (Fortitude), reflective and creative (Mastery), and compassionate and respectful (Charity). AES fosters joy in learning through a forward-looking curriculum and technology-enabled environment, including the SPEAK Applied Learning Programme to build communication skills. Leadership development is integral, with the AES Dinan Leadership Programme and international cultural exchanges via the Asian Youth Leaders for Human Fraternity program. Pastoral care is embedded in the school’s ethos, with a focus on character formation and service. The school environment is supportive and inclusive, aiming to help students discover their strengths and work collaboratively. AES’s motto, “Labor Omnia Vincit” (Through Work Achieve Success), underscores the value of diligence and perseverance. Recent campus enhancements provide vibrant and reflective spaces, supporting holistic student development. Overall,","[{""url"":""https://www.assumptionenglish.moe.edu.sg/about-aes/assumptions-identity/assumptionknight/""},{""url"":""https://www.assumptionenglish.moe.edu.sg/about-aes/assumptions-identity/mission-and-vision/""},{""url"":""https://www.assumptionenglish.moe.edu.sg/about-aes/assumptions-identity/motto-and-crest/""},{""url"":""https://www.assumptionenglish.moe.edu.sg/about-aes/assumptions-identity/school-values/""},{""url"":""https://www.assumptionenglish.moe.edu.sg/about-aes/assumptions-identity/student-outcomes/""},{""url"":""https://www.assumptionenglish.moe.edu.sg/about-aes/montfortian-education-charter/""},{""url"":""https://www.assumptionenglish.moe.edu.sg/about-aes/principals-message/""},{""url"":""https://www.assumptionenglish.moe.edu.sg/about-aes/school-history/""}]",df90f846407f5d2a7045da1e2a55f64d759ddd2f,2025-09-14 02:30:56+00
7004,,chij-secondary-toa-payoh,"CHIJ Secondary, Singapore's oldest Catholic girls' school, fosters a Christ-centred community emphasizing values of compassion, humility, integrity, perseverance, and faith. Rooted in the legacy of the Infant Jesus Sisters, the school promotes truth, justice, freedom, and love, especially for the disadvantaged. Its motto, ""Simple in Virtue, Steadfast in Duty,"" guides students to develop moral clarity, courage, and community-mindedness. The school balances academic excellence with character education, supported by strong alumnae ties and active parental involvement. Strategic focuses include distinctive education, staff empowerment, and organisational excellence, continuing a 170-year tradition of nurturing girls to realize their potential and contribute positively to society.","CHIJ Secondary is the oldest Catholic girls' school in Singapore and the mother school of all CHIJ schools nationwide. Founded in 1854 by the Infant Jesus Sisters, it has a rich history of providing education to girls from diverse backgrounds, with a special commitment to those disadvantaged. The school’s mission is to create a Christ-centred community promoting truth, justice, freedom, and love. Its core values—compassion, humility, integrity, perseverance, and faith—are deeply embedded in the school culture. The motto, ""Simple in Virtue, Steadfast in Duty,"" encapsulates the school's emphasis on moral clarity and steadfastness in responsibility. CHIJ Secondary nurtures students to develop their own convictions, encouraging informed and community-minded choices alongside intellectual excellence. The school has a strong tradition of character education, recognized by awards such as the Outstanding Development Award in Character Education. The school community includes dedicated staff, active parents through the Parent Support Group, and a supportive IJ Board. Alumnae maintain close ties, fostering a lifelong sisterhood. Strategic thrusts focus on delivering a distinctive IJ education, empowering staff, and maintaining organisational excellence. Celebrating over 170 years, CHIJ Secondary continues to uphold the legacy of the Infant Jesus Sisters by nurturing every girl’s potential to make a positive difference in society.","[{""url"":""https://www.chijsec.edu.sg/about-us/chij-history/""},{""url"":""https://www.chijsec.edu.sg/about-us/mission-vision-our-crest-and-motto/""},{""url"":""https://www.chijsec.edu.sg/about-us/principals-message/""}]",65b42ba3598e83e05e52ad0dd54ca77f5a9d75b4,2025-09-14 02:31:02+00
