school_code,school_slug,school_name,short_summary,long_summary,sources,source_hash,updated_at
3063,,jurongville-secondary-school,"Jurongville Secondary School, formed from the 2019 merger of Jurongville and Hong Kah Secondary Schools, embraces the motto 'Beyond Self' and the values of Perseverance, Respect, Integrity, Discipline, and Empathy (PRIDE). The school focuses on holistic education, developing students' character, leadership, and community engagement alongside academic excellence. Its nurturing environment encourages students to grow as responsible, compassionate individuals ready to contribute meaningfully to society. Programs include diverse co-curricular activities, leadership development, and service-learning projects. The school fosters strong partnerships with alumni, parents, and community organizations to support student growth and real-world exposure. Jurongville aims to cultivate passionate, resilient learners who are prepared to thrive locally and globally.","Jurongville Secondary School, established in 1994 and merged with Hong Kah Secondary School in 2019, is committed to nurturing well-rounded students through a holistic education approach. The school’s philosophy, 'Everyone can Learn, Everyone can Achieve, Everyone can Contribute,' underpins its mission to develop world-ready students who learn, lead, and serve. The school motto, 'Beyond Self,' reflects its emphasis on character development and community contribution. Jurongville instills core values encapsulated in the acronym PRIDE: Perseverance, Respect, Integrity, Discipline, and Empathy. These values guide students to overcome challenges, respect others, act responsibly, maintain exemplary conduct, and be sensitive to others’ needs. Beyond academics, the school offers a broad range of co-curricular activities, leadership programs, and service-learning projects designed to build teamwork, resilience, empathy, and responsibility. Jurongville also maintains strong partnerships with alumni, parents, and local organizations, providing mentorship and real-world learning opportunities. The school’s crest symbolizes growth and global aspirations, representing its commitment to nurturing students to thrive in Singapore and beyond. With a supportive community and dedicated staff, Jurongville prepares students not only for academic success but also to be confident, compassionate individuals who contribute positively to society.","[{""url"":""https://www.jurongvillesec.moe.edu.sg/about-us/crest-song/""},{""url"":""https://www.jurongvillesec.moe.edu.sg/about-us/philosophy-motto-values/""},{""url"":""https://www.jurongvillesec.moe.edu.sg/about-us/principal-message/""},{""url"":""https://www.jurongvillesec.moe.edu.sg/about-us/sch-history/""},{""url"":""https://www.jurongvillesec.moe.edu.sg/about-us/vision-mission/""}]",2e08f23ea022b932ad11d98b99d2d7dd8f543cc2,2025-09-14 02:24:37+00
3065,,kranji-secondary-school,"Kranji Secondary School, established in 1995, emphasizes holistic student development through its values-driven culture symbolized by its crest. The school fosters five shared national values and encourages determination and perseverance in academics and co-curricular activities. It offers distinctive programmes including the Applied Learning Programme focused on design innovation for sustainable living, and the Learning for Life Programme nurturing community and youth leadership. The school promotes self-directed learning, caring leadership, and active community contribution, supported by a caring teaching team and integration of educational technology. Signature events like the annual Mid-Autumn Festival celebrate cultural appreciation and community involvement, reflecting the school’s commitment to student growth in intellectual, moral, physical, social, and aesthetic domains.","Kranji Secondary School, founded in 1995 and located at 61 Choa Chu Kang Street 51 since 1996, is committed to the all-round development of its students. The school crest symbolizes its core values: youthful dynamism, responsibility, respect, and growth, represented by the colours red and green and the five pillars reflecting the five shared national values. These values include nation before community, family as the basic unit, community support, consensus, and racial and religious harmony. The school’s culture emphasizes determination and perseverance to excel academically and in co-curricular activities through collaboration among students, teachers, parents, and the community. Kranji Secondary has a strong focus on leadership development, affirmed by its Learning for Life Programme titled “Nurturing A Leader in Every Kranjian through Community and Youth Leadership,” which aims to realize leadership potential in every student through training and opportunities. Its Applied Learning Programme, started in 2016 and repositioned in 2021, centers on design innovation for sustainable living aligned with the Singapore Green Plan 2030, fostering reflective and independent learners through a customized Thinking Curriculum. The school’s signature community engagement includes a long-standing collaboration with local Citizens’ Consultative Committees to celebrate the annual Mid-Autumn Festival, where students showcase cultural performances and innovative booths. The school integrates educational technology to enhance learning and offers internationalisation programmes to broaden students’ perspectives. Overall, Kranji Secondary nurtures self-directed learners, caring leaders, and active contributors, preparing students to be creators, connectors, and contributors in society.","[{""url"":""https://www.kranjisec.moe.edu.sg/about-us/school-crest/""},{""url"":""https://www.kranjisec.moe.edu.sg/our-kranji/our-history/""},{""url"":""https://www.kranjisec.moe.edu.sg/our-kranji/permalink/principalmessage/""}]",6b71b8973638007f2ce64cb9b1b9cdb80097ff87,2025-09-14 02:24:43+00
3066,,juying-secondary-school,"Juying Secondary School fosters a nurturing environment that values respect, responsibility, integrity, gratitude, humility, and tenacity, collectively known as the R2IGHT core values. The school emphasizes holistic development through its PASSION and CCE programmes, aiming to cultivate 21st-century competencies such as inventive thinking, communication, and resilience. Juying promotes lifelong learning, strength of character, and impactful leadership, supported by a strong partnership with parents and the community. The school’s ethos encourages students to be empathetic, curious, and adaptable, preparing them to navigate a complex and rapidly changing world with confidence and compassion.","Founded in 1994, Juying Secondary School has developed a culture centered on nurturing every student as a unique individual capable of lifelong learning and character development. The school’s philosophy likens students to oysters that create pearls, emphasizing talent development and empowerment. Juying’s R2IGHT core values—Respect, Responsibility, Integrity, Gratitude, Humility, and Tenacity—guide student conduct and character education. These values are reinforced through the JYian Code of Conduct, which promotes courteousness, accountability, moral uprightness, kindness, modesty, and perseverance. The school’s strategic thrusts focus on cultivating passionate and confident learners, values-driven leaders with holistic health, mission-driven staff role models, and purposeful partnerships with parents and community. Programmes such as PASSION and Character and Citizenship Education (CCE) are designed to build 21st-century competencies including inventive thinking, communication skills, and intellectual agility. Juying also prioritizes empathy and adaptability to prepare students for the challenges of a complex, unpredictable world. The school’s holistic approach integrates academic excellence with character and leadership development, supported by a collaborative environment involving staff, students, and parents.","[{""url"":""https://www.juyingsec.moe.edu.sg/information/principals-message/principals-message-2023/""},{""url"":""https://www.juyingsec.moe.edu.sg/information/school-overview/core-values/""},{""url"":""https://www.juyingsec.moe.edu.sg/information/school-overview/h-e-a-r-t-s-ethos/""},{""url"":""https://www.juyingsec.moe.edu.sg/information/school-overview/school-history/""},{""url"":""https://www.juyingsec.moe.edu.sg/information/school-overview/strategic-thrusts/""},{""url"":""https://www.juyingsec.moe.edu.sg/information/school-overview/vision-n-mission/""}]",4b63c09eeed4b55cc5453ce376bd815557a2fc51,2025-09-14 02:24:49+00
3067,,west-spring-secondary-school,"West Spring Secondary School emphasizes holistic development, character building, and leadership. The school fosters values of resilience, integrity, care, and harmony, aiming to nurture students into leaders of character and lifelong learners. It offers updated Applied Learning and Learning for Life programmes focused on sustainability and community youth leadership, encouraging students to engage in real-world issues and community projects. The school maintains a reputation for good discipline and a caring environment, supported by strong partnerships with parents and the community.","West Spring Secondary School, established in 2001, has developed a culture centered on holistic education, strong character development, and leadership cultivation. The school’s vision, ""Leaders of Character, Learners for Life,"" reflects its commitment to nurturing resilient individuals with integrity who can collaborate across diverse backgrounds and demonstrate care for themselves and others. Character education is a key focus, with initiatives designed to instill self-discipline, positive mindsets, and attitudes essential for learning and life. The school’s Applied Learning Programme (ALP) advocates sustainability, encouraging students to address environmental challenges and influence their peers and community. Complementing this, the Learning for Life Programme (LLP) in Community Youth Leadership fosters empathy and compassion by engaging students in designing and implementing community projects that improve local lives. These programmes aim to help students find purpose and meaning through contributing to causes greater than themselves. West Spring also values strong discipline and a supportive, caring environment, bolstered by active involvement from parents, the School Advisory Committee, and the wider community. The school’s history of achievements in academics, sports, and the arts, alongside leadership development initiatives like the TLC approach, further underpin its holistic ethos.","[{""url"":""https://www.westspringsec.moe.edu.sg/about-us/school-crest-and-school-song/""},{""url"":""https://www.westspringsec.moe.edu.sg/about-us/school-history/""},{""url"":""https://www.westspringsec.moe.edu.sg/about-us/school-vision-mission-values/""},{""url"":""https://www.westspringsec.moe.edu.sg/about-wsss/principal-foreword/""}]",a0bc183a9da7cd0f1e1cbbf003f48b84e4bdbe3e,2025-09-14 02:24:53+00
3068,,jurong-west-secondary-school,"Jurong West Secondary School (JWSS) fosters holistic development through strong academic and non-academic programmes. The school emphasizes values such as strength of character, innovation, lifelong learning, and community service. Key initiatives include the Applied Learning Programme, Learning for Life Programme, JeWel talent development, and the Enhanced Art Programme. JWSS supports students with diverse talents and interests, offering opportunities like overseas exchanges and student attachments. The school culture is marked by care, support, and innovation, preparing students to be future-ready learners, thinkers, and leaders in a complex world.","Established in 2001, Jurong West Secondary School (JWSS) has developed a culture centered on holistic education, combining academic excellence with character development and co-curricular achievements. The school’s vision, “Learners, Thinkers, Leaders of Tomorrow,” guides its focus on nurturing future-ready students equipped with strong values and enduring skills. JWSS offers distinctive programmes such as the Applied Learning Programme, which encourages innovative ICT-based solutions to real-world problems; the Learning for Life Programme, which promotes community service and leadership; and the JeWel Programme, which supports talent development in English, Mathematics, Science, Art, and Sports. The Enhanced Art Programme further deepens artistic expression through multidisciplinary approaches. JWSS also provides experiential learning opportunities including student work attachments, overseas exchanges, and mentorships with Members of Parliament. The school’s culture emphasizes strength of character, innovation, and lifelong learning, symbolized by its eagle crest. A supportive and caring environment fosters social-emotional competencies, enabling students to thrive amid an increasingly volatile and complex world. As a pilot school for Full Subject-Based Banding, JWSS adapts to diverse student strengths and interests, reinforcing its commitment to inclusive and broad-based education.","[{""url"":""https://www.jurongwestsec.moe.edu.sg/about-us/history/""},{""url"":""https://www.jurongwestsec.moe.edu.sg/about-us/principals-message/""},{""url"":""https://www.jurongwestsec.moe.edu.sg/files/About%20Us/COC/JWSS_Code_of_Conduct_202324.pdf""}]",9f35f4ca31728902457a4b9bd8694974dfb9d58d,2025-09-14 02:24:58+00
3069,,bedok-green-secondary-school,"Bedok Green Secondary School (BGSS) fosters a nurturing environment emphasizing resilience, integrity, compassion, and humility. Its students are encouraged to be courageous, reflective, confident leaders, inventive thinkers, and caring citizens. The school values lifelong learning and holistic development through a broad range of educational programs and co-curricular activities. BGSS integrates its heritage with the legacy of Ping Yi Secondary School, enriching its culture with a commitment to fairness and dignity. The school crest and motto symbolize growth, strength, and excellence, reflecting BGSS’s vision to prepare students to face future challenges with confidence and purpose.","Bedok Green Secondary School (BGSS) was established in 2001 and has since developed a school culture centered on its RICH values: Resilience, Integrity, Compassion, and Humility. These values guide students to overcome challenges, act honestly, care for others, and remain open to growth. BGSS students are nurtured to be courageous individuals who uphold integrity, confident leaders who serve with empathy and responsibility, inventive thinkers who embrace curiosity and adaptability, and caring citizens who value relationships and community. The school’s vision is to be a community of lifelong learners, supported by its motto “Believe and Grow” and symbols like the bamboo and diamond representing growth and excellence. The school’s culture was further enriched by the 2021 merger with Ping Yi Secondary School, which brought in a heritage of fairness and dignified bearing, as reflected in its Chinese name (平仪中学). BGSS emphasizes holistic education, offering diverse programs and co-curricular activities that develop physical, aesthetic, leadership, and personal skills. This approach aims to prepare students not only academically but also as well-rounded individuals ready to face future challenges with confidence and purpose.","[{""url"":""https://www.bedokgreensec.moe.edu.sg/about-us/""},{""url"":""https://www.bedokgreensec.moe.edu.sg/about-us/our-heritage/""}]",0ac2c7437f54650028e36ad72ec4611a0b761fda,2025-09-14 02:25:03+00
3070,,punggol-secondary-school,"Punggol Secondary School emphasizes character development through its core values of Propriety, Righteousness, Integrity, and Self-Respect. The school fosters a vibrant environment that nurtures students’ cognitive, moral, physical, social, and aesthetic growth. It offers platforms like the Students Learning Festival to encourage self-directed learning and confidence. The Applied Learning Programme focuses on environmental education for sustainable living, while the Learning for Life Programme develops community and youth leadership. Collaboration with parents and the community supports holistic education, aiming to prepare students to be future-ready, adaptable, and active contributors grounded in strong values.","Punggol Secondary School, established in 1956 originally as Singapore Girls’ Vocational High School, has a longstanding commitment to empowering students and developing their character. The school’s philosophy views education as a journey of self-discovery, helping students identify their strengths, talents, and moral compass based on the values of Propriety, Righteousness, Integrity, and Self-Respect. The school environment is designed to be vibrant and supportive, providing diverse experiences across cognitive, moral, physical, social, and aesthetic domains. Initiatives such as the Students Learning Festival allow students to showcase self-initiated learning, fostering confidence and enthusiasm. The school’s Applied Learning Programme (ALP) in Environment Education promotes understanding of sustainable living through the relationship between science and nature. Additionally, the Learning for Life Programme (LLP) in Community and Youth Leadership encourages students to become active citizens with a heart for service. Punggol Secondary values strong partnerships with parents and the community to support its mission of nurturing future-ready, adaptable students who are active contributors grounded in values. The school crest and song reflect its heritage and commitment to truth, wisdom, and lifelong learning.","[{""url"":""https://www.punggolsec.moe.edu.sg/our-school/principals-message/""},{""url"":""https://www.punggolsec.moe.edu.sg/our-school/school-crest-history-and-song/""},{""url"":""https://www.punggolsec.moe.edu.sg/our-school/school-identity/""}]",c7d0160331b603406ce48b62804c077c6e0d5c4f,2025-09-14 02:25:08+00
3071,,north-vista-secondary-school,"North Vista Secondary School, with roots dating back to 1956, emphasizes holistic education and character development. The school fosters a vibrant culture through diverse co-curricular activities including uniformed groups, military band, and sports. Its house system promotes integration and healthy competition. The school crest symbolizes global outlook, support for innovation, and all-round development. The motto 'Viva La Vista' reflects the school's commitment to pride, knowledge, and excellence. North Vista aims to nurture students of character who learn, strive, and contribute for a better future.","North Vista Secondary School, originally established as Gan Eng Seng Government Chinese Middle School in 1956 and later known as Thomson Secondary School, has a rich history of promoting holistic education. The school has consistently emphasized character development and a broad learning experience, evident from its early introduction of science laboratories and a variety of after-school activities such as uniformed groups, swimming, and a military band. The Student Council, formed in 1972, plays an active role in student welfare and school environment enhancement. The introduction of the House system in 1997 encourages student integration and spirited inter-house competitions. Upon relocating to Sengkang Town in 2000 and adopting the name North Vista Secondary School, the institution retained its Chinese name to honor its heritage. The school crest, featuring a globe supported by hands, represents a global outlook, support for innovation, and a commitment to all-round development. The motto 'Viva La Vista' encapsulates the school's philosophy of pride, commitment, and striving for excellence. North Vista’s vision is to develop 'Vistarians of Character who Learn, Strive, Contribute for a Better Future,' supported by a mission to provide holistic education equipping students with values, knowledge, and skills to face future challenges. The campus is lively with creative events such as bazaars, concerts, and exhibitions, fostering a dynamic and supportive learning environment.","[{""url"":""https://www.northvistasec.moe.edu.sg/school-info/history/""},{""url"":""https://www.northvistasec.moe.edu.sg/school-info/our-crest-n-anthem/""},{""url"":""https://www.northvistasec.moe.edu.sg/school-info/our-vision-mission-n-values/""}]",7683bc23d7adab39281bd472826d696c4885752c,2025-09-14 02:25:19+00
3072,,admiralty-secondary-school,"Admiralty Secondary School (ADSS) emphasizes a value-centric culture centered on Respect, Resilience, Responsibility, Lifelong Learning, Integrity, Graciousness, High Expectations, Teamwork, and Self-Discipline. The school integrates technology and innovation through its Applied Learning Programme in Design Thinking and Robotics, and promotes leadership and community service via its Learning for Life Programme. ADSS fosters self-directed learning with tools like iPads and nurtures holistic development through sports and heritage appreciation. The school aims to develop confident, adaptable, and socially responsible students prepared for 21st-century challenges, supported by strong partnerships with parents and the community.","Established in 2002, Admiralty Secondary School (ADSS) has cultivated a culture grounded in its core values summarized as R³ich in LIGHTS: Respect, Resilience, Responsibility, Lifelong Learning, Integrity, Graciousness, High Expectations, Teamwork, and Self-Discipline. These values guide students, known as Admirals, to develop moral courage, empathy, accountability, and social cohesion. ADSS integrates technology deeply into its curriculum, recognized for its niche in Robotics Enterprise since 2006. Its Applied Learning Programme focuses on Design Thinking through Innovation and Technology, equipping students with electronics, programming, and coding skills. Complementing this, the Learning for Life Programme nurtures mindful leaders through community outreach, fostering life skills and responsible citizenship. The school promotes self-directed learning by providing iPads to all students, encouraging ownership of their educational journey. Holistic development is supported by facilities like the Indoor Sports Hall and initiatives such as the Northern Heritage Trail, which connects students to local history and culture. ADSS values strong collaboration with parents and stakeholders to create a nurturing environment where students become confident, adaptable leaders ready to contribute meaningfully to society.","[{""url"":""https://www.admiraltysec.moe.edu.sg/about-us/our-history/""},{""url"":""https://www.admiraltysec.moe.edu.sg/about-us/vmv/permalink/""},{""url"":""https://www.admiraltysec.moe.edu.sg/principalmessage/permalink/""}]",067d604227d91f2cb8067fbfbcbe2d05d9ac4bec,2025-09-14 02:25:26+00
3073,,pei-hwa-secondary-school,"Pei Hwa Secondary School focuses on nurturing Future-Ready Learners and Forward-Looking Leaders through a holistic education that emphasizes values, innovation, and community service. The school’s culture promotes resilience, critical thinking, creativity, empathy, and social responsibility. Signature programs include the Future Leaders Programme (formerly Project Work), an Applied Learning Programme in Robotics and Programming, and a Learning for Life Programme in Community Youth Leadership. Pei Hwa encourages students to take ownership of their learning and actively contribute to society, supported by strong partnerships with parents, alumni, and community stakeholders.","Established in 2005, Pei Hwa Secondary School is committed to developing well-rounded individuals equipped with critical thinking, creativity, empathy, and social responsibility. The school’s vision is to nurture Future-Ready Learners and Forward-Looking Leaders who possess the zest to learn, the dare to innovate, and the heart to lead and serve. Central to its culture is a resilient and value-grounded student identity, symbolized in its logo. Pei Hwa offers a holistic education through key initiatives such as the Future Leaders Programme, which integrates the Applied Learning Programme in Robotics and Programming and the Learning for Life Programme focused on Community Youth Leadership. The school emphasizes experiential learning, collaboration, and community engagement, including biennial events like PHiesta and Community Day. It also participates in national initiatives such as Full Subject-Based Banding and serves as a Zonal Lead School for Makers’ Education. With strong support from parents, alumni, and community partners, Pei Hwa fosters a caring environment that encourages students to dream big, take ownership of their learning, and contribute meaningfully to society.","[{""url"":""https://www.peihwasec.moe.edu.sg/we-are-pei-hwa/our-motto-logo-and-song/""},{""url"":""https://www.peihwasec.moe.edu.sg/we-are-pei-hwa/our-story/""},{""url"":""https://www.peihwasec.moe.edu.sg/we-are-pei-hwa/our-vision-mission-and-values/""},{""url"":""https://www.peihwasec.moe.edu.sg/we-are-pei-hwa/principal-message/""}]",1ef6c82910ba1e7b6b2a7fd838a7003400ab9260,2025-09-14 02:25:32+00
