school_code,school_slug,school_name,short_summary,long_summary,sources,source_hash,updated_at
3226,,hua-yi-secondary-school,"Hua Yi Secondary School fosters a culture grounded in its core values of Benevolence, Justice, Wisdom, and Togetherness. The school emphasizes nurturing passionate learners, resilient leaders, empathetic contributors, and globally minded citizens through a holistic curriculum. Its heritage as one of Singapore’s first government Chinese secondary schools informs its commitment to character development, bilingualism, and social responsibility. The 2025 theme “Voices that Care” highlights the importance of empathy, respectful communication, and community impact. Supported by active alumni and parent groups, Hua Yi aims to develop students who are confident, caring, and ready to contribute meaningfully to society.","Hua Yi Secondary School has a rich history as one of Singapore’s earliest government-established Chinese secondary schools, founded in 1956 to provide stable education amid social unrest. Over the decades, it has evolved into a vibrant institution that balances tradition with innovation. The school’s culture is deeply rooted in its core values of 仁 (Benevolence), 义 (Justice), 智 (Wisdom), and 群 (Togetherness), which shape students into individuals of integrity, compassion, and purpose. Hua Yi’s vision is to “Inculcate Values, Inspire Talents, Impact Communities,” guiding a holistic education that nurtures passionate learners who take ownership of their learning, resilient leaders who make courageous decisions, empathetic contributors who actively help others, and glocalised citizens who stay connected to Singapore while understanding global trends. The 2025 school theme, “Voices that Care,” encourages students to communicate confidently and respectfully, fostering empathy and social responsibility. The school community is strengthened by the support of the Hua Yi Alumni Society, School Advisory Board, and Parents Support Group, which provide resources and opportunities for student development. Hua Yi’s commitment to bilingualism, character education, and leadership development prepares students to thrive in a dynamic world and make meaningful contributions to society.","[{""url"":""https://www.huayisec.moe.edu.sg/who-we-are/Our-Identity/crest-song/""},{""url"":""https://www.huayisec.moe.edu.sg/who-we-are/Our-Story/hist-herit/""},{""url"":""https://www.huayisec.moe.edu.sg/who-we-are/our-identity/principals-message/""},{""url"":""https://www.huayisec.moe.edu.sg/who-we-are/our-identity/student-outcomes/""},{""url"":""https://www.huayisec.moe.edu.sg/who-we-are/our-identity/vision-mission-values/""}]",551eb95c279f39a0bd4a8471091b338913ea0115,2025-09-14 02:27:30+00
3228,,deyi-secondary-school,"Deyi Secondary School, established in 1980, emphasizes the values of dedication, integrity, determination, diligence, and discipline. The school fosters holistic development through distinctive programs such as the Active Voice Broadcast Journalism Programme, Youth Social Entrepreneurship Programme, and signature drama-in-curriculum modules. Its Student Leadership Development Programme nurtures confident leaders, while experiential learning and partnerships with higher institutions prepare students for the future. The school culture values moral uprightness, academic drive, and gracious citizenship, supported by a caring and empowering environment. Teachers are committed to professional growth and innovative teaching, leveraging technology and diverse pedagogies. Deyi’s ethos encourages students to be active learners, resilient, and socially responsible, embodying the school motto and spirit.","Deyi Secondary School, founded in 1980 as Teck Ghee Secondary School, is guided by the motto 'Dedication and Integrity' and the philosophy that every student is a gem with potential to be realized. The school culture centers on nurturing morally upright, academically driven, and gracious citizens through a broad range of programs and values. Key initiatives include the Active Voice Broadcast Journalism Programme, which enhances language literacy, critical thinking, and communication skills; the Youth Social Entrepreneurship Programme, which engages students in community service and social problem-solving; and arts education featuring drama-in-curriculum modules that cultivate empathy and contribution. The Student Leadership Development Programme builds confident leaders who actively contribute to school and society. Deyi’s AC3TIve Framework and Mi-Ke-Mon curriculum innovation promote joyful and engaged learning across subjects. The school emphasizes holistic education with learning journeys, experiential learning, and career guidance in collaboration with institutes of higher learning. Teachers are dedicated to continuous professional development, employing technology and diverse pedagogies to inspire students. The school fosters a safe, empowering environment where students develop self-discipline, respect, and adaptive thinking to face future challenges. Relationships among students, staff, and stakeholders create a warm, caring culture, reinforcing shared values and pride in the Deyi legacy. The school prepares students to be future-ready, socially responsible, and resilient, embodying the spirit of dedication, integrity, and perseverance.","[{""url"":""https://www.deyisec.moe.edu.sg/about-us/our-school/""},{""url"":""https://www.deyisec.moe.edu.sg/about-us/principals-message/""}]",943ad6b7a6272ccc6635564a6872d2d30e6f8cb5,2025-09-14 02:27:37+00
3232,,peicai-secondary-school,"Peicai Secondary School, established in 1984, emphasizes holistic education combining academic excellence and character development. Guided by its motto ""We Make the Difference"" and values encapsulated in PR²IDE (Perseverance, Respect and Responsibility, Integrity, Discipline, Empathy), the school nurtures critical and independent learners with compassionate hearts. It fosters leadership and advocacy among students, encouraging them to contribute positively to society. The school supports staff development and values strong partnerships with parents, alumni, and the community to help students realize their full potential and prepare for future challenges.","Peicai Secondary School, formed in 1984 through the amalgamation of Parry and Hwi Yoh Secondary Schools, is committed to nurturing talents as reflected in its name meaning ""Nurture of Talents."" The school’s vision is to develop students with critical minds and compassionate hearts, supported by its mission to nurture independent learners who care for self, family, and society. The school’s core values, known as PR²IDE, include Perseverance, Respect and Responsibility, Integrity, Discipline, and Empathy, which underpin its character education efforts. Principal Michael Muhunthan highlights the school’s focus on holistic development, balancing academic achievement with character building. Students are encouraged to pursue their passions and leadership roles, becoming advocates for causes that benefit the school and wider community. The school fosters a supportive environment for teachers’ professional growth and maintains strong collaborations with the School Advisory Committee, Parent Support Group, alumni, and community partners. These efforts contribute to consistent academic progress, strong co-curricular achievements, and high post-secondary eligibility rates. The school song and motto reinforce loyalty, unity, diligence, and a commitment to success and virtue, reflecting the school’s ethos of preparing students to face future opportunities and challenges confidently.","[{""url"":""https://www.peicaisec.moe.edu.sg/about-us/mission-vision-and-values/""},{""url"":""https://www.peicaisec.moe.edu.sg/about-us/peicais-history/""},{""url"":""https://www.peicaisec.moe.edu.sg/about-us/principal-s-message/""},{""url"":""https://www.peicaisec.moe.edu.sg/about-us/school-crest-and-song/""}]",9c6465153efc2b6ee249077e59b28df82febe8ec,2025-09-14 02:27:42+00
3235,,pasir-ris-secondary-school,"Pasir Ris Secondary School, established in 1985 as the first secondary school in Tampines, emphasizes the core values of Pride, Responsibility, Integrity, Zeal, and Empathy. The school fosters confident learners and caring, resilient citizens through holistic education, combining academic excellence with character development. It offers a nurturing environment supported by dedicated staff, effective curricular and co-curricular programs, and initiatives like 1-1 Personal Learning Devices to prepare students for the future. The school promotes strong partnerships with parents and encourages student leadership, service, and respect, aligned with its motto 'Pride and Responsibility.'","Founded in 1985, Pasir Ris Secondary School was the first secondary school in Tampines and has since developed a strong community presence. The school’s culture centers on its motto, 'Pride and Responsibility,' reflecting its commitment to instilling these values in every student. Pasir Ris Secondary aims to nurture confident learners who are inquisitive, motivated, and reflective, as well as caring and resilient citizens who embrace challenges and contribute positively to society. The school’s mission focuses on inspiring lives, nurturing talents, and realizing dreams by providing quality education and a supportive environment. Character education is integral, with core values including Pride, Responsibility, Integrity, Zeal, and Empathy guiding student conduct and development. The school integrates technology through a 1-1 Personal Learning Device program to cultivate self-directed digital learners equipped with 21st-century competencies. Co-curricular activities and pastoral care are emphasized to build socio-emotional skills and leadership qualities. The school also fosters strong home-school partnerships, encouraging parental involvement through the Parent Support Group and parenting workshops. Overall, Pasir Ris Secondary School strives to develop well-rounded students who excel academically, demonstrate good character, and are prepared to navigate future challenges.","[{""url"":""https://www.pasirrissec.moe.edu.sg/about-us/Our-Heritage/""},{""url"":""https://www.pasirrissec.moe.edu.sg/about-us/Principals-Foreword/""},{""url"":""https://www.pasirrissec.moe.edu.sg/about-us/Student-Creed/""},{""url"":""https://www.pasirrissec.moe.edu.sg/about-us/school-symbols/""},{""url"":""https://www.pasirrissec.moe.edu.sg/about-us/vision-mission-and-values/""}]",bfd61587dbaea2c82fed9495b3bb9ccdca27bfca,2025-09-14 02:27:47+00
3238,,guangyang-secondary-school,"Guangyang Secondary School values resilience, lifelong learning, and adaptability, inspired by the principal’s family legacy of education overcoming adversity. The school fosters perseverance through challenges and encourages kindness and strong social connections among students. It has a history rooted in Kong Yiong High School and has evolved through mergers and facility upgrades. Guangyang emphasizes building students’ character and potential to impact future generations, preparing them for a rapidly changing world.","Guangyang Secondary School’s culture is deeply influenced by its principal’s personal narrative emphasizing resilience, sacrifice, and the transformative power of education. The school encourages students to develop perseverance by embracing challenges, learning from both setbacks and successes, and cultivating kindness and strong social bonds. This approach aligns with the principal’s belief that education is a lifelong journey requiring adaptability in a fast-changing world. Guangyang’s heritage traces back to Kong Yiong High School, established in 1948, and was reestablished as Guangyang Secondary in 1987, adopting the Hanyu pinyin name from its predecessor. The school has undergone significant development, including a major rebuilding under the PRIME program in 2002 and a merger with Braddell-Westlake Secondary School in 2006, retaining the Guangyang name. Facilities include modern classrooms, science labs, computer rooms, and sports amenities. The school has been recognized for value-added academic performance and continues to focus on nurturing students’ potential to become future leaders, parents, and mentors, emphasizing character education alongside academic growth.","[{""url"":""https://www.guangyangsec.moe.edu.sg/PRINCIPALSMESSAGE/""},{""url"":""https://www.guangyangsec.moe.edu.sg/about-gyss/history/""}]",87e9586c9b68de76b22de098b32a3ed5c3c7f058,2025-09-14 02:27:51+00
3239,,riverside-secondary-school,"Riverside Secondary School fosters a caring community focused on all-round development across cognitive, social, moral, physical, and aesthetic domains. Anchored by the RS SPIRIT values—Respect, Service, Synergy, Passion, Integrity, Responsibility, Innovation, and Tenacity—the school nurtures future-ready learners equipped with life skills, digital fluency, and leadership capabilities. It emphasizes holistic education through strong academic foundations, media literacy, cyber wellness, and student leadership development via Values in Action and student-led initiatives like the Riverside Model United Nations Conference. Teachers engage in collaborative professional growth to design student-centric, self-directed, and personalized learning experiences. Riverside maintains strong partnerships with parents, alumni, and educational experts to support its mission of nurturing individuals of integrity and grace ready to face global challenges.","Since its establishment in 1987, Riverside Secondary School has evolved into a school recognized for its holistic education and sustained achievements, including two MOE School Distinction Awards (2009, 2015). The school’s culture is built around its vision of being a caring community in a challenging learning environment and its mission to nurture all-round individuals of integrity and grace. Central to this culture are the RS SPIRIT values—Respect, Service, Synergy, Passion, Integrity, Responsibility, Innovation, and Tenacity—which guide students’ character development and daily conduct. Riverside aims to develop future-ready learners who are self-directed, collaborative, and equipped with essential life skills such as media literacy, digital fluency, and cyber wellness. Student leadership is actively cultivated through leadership modules, Values in Action programs, and platforms like the peer-led Riverside Model United Nations Conference, fostering student voice and community contribution. The school also promotes a growth mindset, teaching positive habits like help-seeking, feedback reception, time and sleep management, and goal-setting. Teachers at Riverside continuously improve through communities of practice, designing joyful and personalized learning experiences that leverage technology and collaborative methods. The school’s partnerships with MOE experts, parents, alumni, and advisory committees enrich the educational experience. Riverside’s commitment to character education, academic excellence, and innovative pedagogy positions it as a forward-looking institution preparing students to embrace global challenges with integrity and resilience.","[{""url"":""https://www.riversidesec.moe.edu.sg/about-us/crest-motto-and-song/""},{""url"":""https://www.riversidesec.moe.edu.sg/about-us/principals-message/""},{""url"":""https://www.riversidesec.moe.edu.sg/about-us/school-history/""},{""url"":""https://www.riversidesec.moe.edu.sg/about-us/vision-mission-and-values/""}]",0545b69f86ad0d35a1b4b35cdefa1fce8b019776,2025-09-14 02:27:59+00
3240,,zhonghua-secondary-school,"Zhonghua Secondary School fosters a strong culture of care, collaboration, and learning, rooted in its heritage since 1911. The school emphasizes nurturing students as passionate learners, dynamic leaders, and connected citizens. Its Future-ready Framework equips students with 21st Century Competencies to thrive in a changing global landscape. Zhonghuarians are encouraged to be well-rounded, adaptable, confident, and committed to lifelong learning. Leadership development focuses on values, inclusiveness, communication, and innovation, preparing students to make meaningful contributions to society. The school maintains strong partnerships with parents, alumni, and the community to support holistic student development.","Founded in 1911 by Chinese community leaders inspired by Dr. Sun Yat Sen’s vision, Zhonghua Secondary School was established to provide educational opportunities for girls at a time when female education was undervalued. This pioneering spirit continues to guide the school’s mission to nurture Zhonghuarians into passionate learners, dynamic leaders, and connected citizens. The school culture is characterized by a strong emphasis on care, collaboration, and continuous learning, supported by a dedicated team of teachers and active engagement with parents, alumni, and advisory committees. Zhonghua’s Future-ready Framework is central to its educational approach, aiming to prepare students for life, work, and learning by equipping them with emerging 21st Century Competencies (E21CC). Students are developed to be well-rounded scholars who are discerning, adaptable, confident, and humble, embracing lifelong learning and striving for excellence. Leadership education at Zhonghua focuses on instilling strong values, fostering inclusiveness and diversity, and encouraging effective communication and collaboration. Students are nurtured to be resourceful and innovative, aspiring to make a positive impact and inspire others. The school regularly reviews its curriculum and processes, with validation from senior Ministry of Education personnel, ensuring that its programs meet diverse student needs and maintain a supportive environment for both students and staff. This holistic and forward-looking culture aims to empower Zhonghuarians to navigate complexities and challenges in an ever-changing global context.","[{""url"":""https://www.zhonghuasec.moe.edu.sg/about-us/our-heritage/""},{""url"":""https://www.zhonghuasec.moe.edu.sg/about-us/principals-message/""},{""url"":""https://www.zhonghuasec.moe.edu.sg/about-us/vision-mission-values/""}]",2ab72f678c32925ca477280eafbcbab639e41702,2025-09-14 02:28:06+00
3304,,swiss-cottage-secondary-school,"Swiss Cottage Secondary School fosters a culture centered on its motto, 'For the sake of learning and for the state,' emphasizing a love of learning and service to the nation. The school vision nurtures Thoughtful Leaders who are reflective thinkers, caring citizens, and leaders who serve with honour and humility. Values such as equality, peace, progress, justice, and democracy underpin the school ethos. Teamwork is highly valued, with an emphasis on honour and humility in leadership and service. The school crest and song symbolize knowledge, sportsmanship, fraternity, and dedication to personal and societal growth.","Swiss Cottage Secondary School's culture is deeply rooted in its motto, 'Scientiae Patriaeque Gratia' (For the sake of learning and for the state), reflecting a commitment to developing students who love learning and serve their nation and the world. The school vision is to nurture Thoughtful Leaders who embrace change with discretion, demonstrate care for others, and are reflective, critical, and inventive. These leaders are expected to positively influence their environments, whether in classrooms, CCAs, homes, or society. The mission emphasizes cultivating reflective thinkers who consider the bigger picture and act thoughtfully, caring citizens who respect diversity and promote harmony, and leaders who lead to serve rather than for authority. Core values of honour and humility guide students to develop integrity, respect, self-discipline, and a service-oriented mindset. The school crest embodies ideals of equality, peace, progress, justice, and democracy, while the five rings and houses symbolize sportsmanship and fraternity. Teamwork is fundamental, with a culture that encourages collaboration and shared vision. Overall, Swiss Cottage Secondary School promotes a balanced development of intellect, character, and leadership aimed at contributing meaningfully to society.","[{""url"":""https://www.swisscottagesec.moe.edu.sg/about-us/school-song-and-school-crest/""},{""url"":""https://www.swisscottagesec.moe.edu.sg/about-us/vision-mission-values-motto/""}]",4d46bbe6ea6ea258b7f9f33db36b5958aeef283c,2025-09-14 02:28:11+00
3307,,yusof-ishak-secondary-school,"Yusof Ishak Secondary School, established in 1965 and named after Singapore’s first President, embodies values such as integrity, resilience, respect, confidence, compassion, and responsibility. The school’s vision is to develop 'Leaders for Tomorrow' by nurturing curiosity, creativity, and confidence in students, empowering them as lifelong learners who contribute to society. Its values, summarized as InSPIRE, emphasize integrity, self-respect, purposeful collaboration, inquisitiveness, resilience, and empathy. The school fosters a supportive environment with innovative learning spaces and hosts the Centre for Teaching & Learning Excellence, promoting educational innovation and collaboration among educators.","Yusof Ishak Secondary School (YISS), founded in 1965 as Jubilee Integrated Secondary School, is uniquely named after Singapore’s first President, Encik Yusof Bin Ishak, who is revered for his integrity, resilience, respect, confidence, compassion, and leadership. The school’s vision, 'Leaders for Tomorrow,' focuses on nurturing curiosity, creativity, and confidence in students, empowering them to be lifelong learners who contribute meaningfully to society. Its core values, encapsulated in the acronym InSPIRE, encourage students to live with integrity, lead with self-respect, collaborate with purpose, learn inquisitively, grow resiliently, and serve empathetically. YISS honors its heritage through a dedicated Heritage Gallery that highlights the principles of meritocracy, multiracialism, and modernization embodied by its namesake. The school environment supports innovative teaching and learning, featuring flexible classrooms and creative spaces like art rooms connected to outdoor gardens. YISS also hosts the Centre for Teaching & Learning Excellence (CTLE@YISS), collaborating with master teachers, educational experts, and the Ministry of Education to advance pedagogical practices. Under the leadership of Principal Chen Ziyang, the school continues to prioritize innovation, partnership, and holistic development, preparing students to be responsible and capable leaders. The school will celebrate its 60th anniversary in 2025, marking decades of commitment to educational excellence and character development.","[{""url"":""https://www.yusofishaksec.moe.edu.sg/about-yi/our-heritage/""},{""url"":""https://www.yusofishaksec.moe.edu.sg/about-yi/our-heritage/school-vision-and-mission/""},{""url"":""https://www.yusofishaksec.moe.edu.sg/about-yi/principals-welcome/""}]",25a27d594c3c4b1718da0adebacf1c497e1f437d,2025-09-14 02:28:17+00
